{
  "version": "1.0",
  "task": {
    "title": "",
    "user_request": "",
    "summary": ""
  },
  "workflow_type": "explain_code",
  "risk_level": "low",
  "recommended_confidence_level": "level_1_analyze_only",
  "selected_confidence_level": "level_1_analyze_only",
  "explicit_edit_approval": false,
  "allowed_actions": [
    "Read relevant files",
    "Summarize findings"
  ],
  "forbidden_actions": [
    "Modify files outside .agent/session/",
    "Run destructive commands"
  ],
  "files_inspected": [],
  "commands_run": [],
  "files_modified": [],
  "agent_findings": [],
  "agent_recommendations": [],
  "human_review_items": [],
  "verification_commands": [],
  "final_status": "not_started",
  "next_suggested_step": ""
}
